{
  "$schema": "https://json-schema.org/draft/2020-12/schema",
  "$id": "https://github.com/Dorusto/yt-pipeline/schemas/quality.schema.json",
  "title": "quality",
  "description": "Measured footage quality written by scripts/quality.py per clip: one segment per interval with a role and confidence plus measured defects. Segments tile the clip with no gaps. These are labels only — nothing is ever deleted or cut here; the director and the human decide. Intent and defect stay separate: blur during a whip pan is intent, blur on a hold is a defect.",
  "type": "object",
  "required": ["file", "duration_s", "segments"],
  "$defs": {
    "role": {
      "type": "string",
      "enum": [
        "move",
        "hold",
        "transition_in",
        "transition_out",
        "setup",
        "teardown",
        "accidental"
      ]
    },
    "defect_name": {
      "type": "string",
      "enum": ["blur", "shake", "exposure", "obstruction", "horizon"]
    }
  },
  "properties": {
    "file": {
      "type": "string",
      "minLength": 1,
      "description": "clip file name"
    },
    "path": {
      "type": "string",
      "description": "absolute path of the analysed clip"
    },
    "generated_at": {
      "type": "string",
      "description": "ISO 8601 timestamp of the analysis run"
    },
    "duration_s": {
      "type": "number",
      "minimum": 0
    },
    "motion_file": {
      "type": ["string", "null"],
      "description": "motion JSON used for segmentation and roles, when one was found"
    },
    "segments": {
      "type": "array",
      "minItems": 1,
      "description": "segments covering the whole clip in time order",
      "items": {
        "type": "object",
        "required": ["id", "start_s", "end_s", "role", "confidence", "defects"],
        "properties": {
          "id": {"type": "string", "minLength": 1},
          "start_s": {"type": "number", "minimum": 0},
          "end_s": {"type": "number", "minimum": 0},
          "role": {"$ref": "#/$defs/role"},
          "confidence": {
            "type": "number",
            "minimum": 0,
            "maximum": 1,
            "description": "how sure the role assignment is; setup/teardown/accidental are likely roles, never verdicts"
          },
          "role_evidence": {
            "type": "array",
            "items": {"type": "string"},
            "description": "short human-readable reasons for the role"
          },
          "motion_label": {
            "type": ["string", "null"],
            "description": "CameraBench label of the overlapping move from the motion file, or the segment's own dominant motion"
          },
          "defects": {
            "type": "array",
            "description": "measured defects only; empty when the segment is clean",
            "items": {
              "type": "object",
              "required": ["name", "value"],
              "properties": {
                "name": {"$ref": "#/$defs/defect_name"},
                "value": {
                  "type": "number",
                  "minimum": 0,
                  "maximum": 1,
                  "description": "normalised severity, higher is worse"
                },
                "detail": {
                  "type": "string",
                  "description": "human-readable measurement, e.g. 'laplacian 0.28x clip median' or 'horizon 3.1 deg'"
                }
              },
              "additionalProperties": true
            }
          },
          "metrics": {
            "type": "object",
            "description": "the raw measurements behind the defects",
            "properties": {
              "laplacian_rel": {
                "type": "number",
                "minimum": 0,
                "description": "Laplacian variance divided by the clip's own median"
              },
              "clip_high_pct": {
                "type": "number",
                "minimum": 0,
                "maximum": 100,
                "description": "percent of pixels blown to white"
              },
              "clip_low_pct": {
                "type": "number",
                "minimum": 0,
                "maximum": 100,
                "description": "percent of pixels crushed to black"
              },
              "mean_luma": {
                "type": "number",
                "minimum": 0,
                "maximum": 255
              },
              "shake": {
                "type": "number",
                "minimum": 0,
                "description": "high-frequency trajectory residual energy"
              },
              "obstruction": {
                "type": "number",
                "minimum": 0,
                "maximum": 1,
                "description": "share of the frame that is large, low-detail and static"
              },
              "horizon_deg": {
                "type": "number",
                "description": "roll offset of the horizon in degrees, meaningful on holds"
              }
            },
            "additionalProperties": true
          }
        },
        "additionalProperties": true
      }
    },
    "warnings": {
      "type": "array",
      "items": {"type": "string"}
    }
  },
  "additionalProperties": true
}
